uuid,properties.name,properties.identifier.permalink,properties.identifier.image_id,properties.identifier.uuid,properties.identifier.entity_def_id,properties.identifier.value,properties.primary_job_title,properties.description,properties.primary_organization.permalink,properties.primary_organization.image_id,properties.primary_organization.uuid,properties.primary_organization.entity_def_id,properties.primary_organization.value,properties.gender
7ba6a4bc-2f88-44ce-95c8-d88438f19983,Trevor Niblock,trevor-niblock,dfej579qdida369j7zlr,7ba6a4bc-2f88-44ce-95c8-d88438f19983,person,Trevor Niblock,Head of Global Partner Marketing Enablement,"Trevor Niblock is the Head of Global Partner Marketing Enablement at Amazon Web Services (AWS). He attended the University of California, Berkeley, Haas School of Business.",amazon-web-services,r4wsu8rl4jvpjydbhooy,bd23a50d-2ae3-be33-2a35-383ea9ed13fd,organization,Amazon Web Services,male
3b5503f2-ae13-42fd-946c-76463e54cebb,Jon Hammant,jon-hammant,qdij1quytukgx7uz3lki,3b5503f2-ae13-42fd-946c-76463e54cebb,person,Jon Hammant,Head of Compute UK & Ireland,Jon Hammant is the Head of Compute UK & Ireland at Amazon Web Services. He attended the University of Reading.,amazon-web-services,r4wsu8rl4jvpjydbhooy,bd23a50d-2ae3-be33-2a35-383ea9ed13fd,organization,Amazon Web Services,male
d3a4ac6d-25e8-9e72-c535-6ac072f3efb6,Faraz Shafiq,faraz-shafiq,v1491737454/tzbvqpettlzgl3zzgwdr.png,d3a4ac6d-25e8-9e72-c535-6ac072f3efb6,person,Faraz Shafiq,"Sr Executive, WW Head Digital Transformation","Faraz Shafiq is the GM Product Management - WW Head Digital Transformation at Amazon Web Services (AWS) . He  attended University of California, Berkeley, Haas School of Business.",amazon-web-services,r4wsu8rl4jvpjydbhooy,bd23a50d-2ae3-be33-2a35-383ea9ed13fd,organization,Amazon Web Services,male
daf53b5a-3735-496a-a331-89c823732102,Rowland Illing,rowland-illing,rvxdwr5mtq06qciqjnyk,daf53b5a-3735-496a-a331-89c823732102,person,Rowland Illing,"Director & Chief Medical Officer, International Government Health",,amazon-web-services,r4wsu8rl4jvpjydbhooy,bd23a50d-2ae3-be33-2a35-383ea9ed13fd,organization,Amazon Web Services,male
0da16d9c-1150-5e2d-cb03-692b984ecd42,Zubin Chagpar,zubin-chagpar,v1397184391/b77c37db39ec71d5e33935e02c699ed4.jpg,0da16d9c-1150-5e2d-cb03-692b984ecd42,person,Zubin Chagpar,Head of Middle East and Africa,Zubin Chagpar serves as an advisor at Tyba.,amazon-web-services,r4wsu8rl4jvpjydbhooy,bd23a50d-2ae3-be33-2a35-383ea9ed13fd,organization,Amazon Web Services,male
9097e680-b576-11be-5d75-0293e1fe9dab,Bernard Leong,bernard-leong,v1428240386/z5ty8ucbgacpsrxgoj9n.jpg,9097e680-b576-11be-5d75-0293e1fe9dab,person,Bernard Leong,Head of Machine Learning and Artificial Intelligence,,amazon-web-services,r4wsu8rl4jvpjydbhooy,bd23a50d-2ae3-be33-2a35-383ea9ed13fd,organization,Amazon Web Services,male
432c6e24-9dfd-9925-0a6c-3aaecbac8305,Lily Xu,lily-xu,v1409331670/nku5dlhrhpngizo0p2ir.jpg,432c6e24-9dfd-9925-0a6c-3aaecbac8305,person,Lily Xu,Underrepresented Founder Startups,,amazon-web-services,r4wsu8rl4jvpjydbhooy,bd23a50d-2ae3-be33-2a35-383ea9ed13fd,organization,Amazon Web Services,female
b015c8f3-c804-26ef-bf8f-aaa7993f3ee5,Bill Vass,bill-vass,v1397632760/10c02601e973089b8089858a8a71a81d.jpg,b015c8f3-c804-26ef-bf8f-aaa7993f3ee5,person,Bill Vass,VP Engineering,Bill Vass is the VP Engineering of Amazon Web Services.,amazon-web-services,r4wsu8rl4jvpjydbhooy,bd23a50d-2ae3-be33-2a35-383ea9ed13fd,organization,Amazon Web Services,male
653115e5-54e3-60a2-9b7a-d949c7fb8208,John Brigden,john-brigden,v1453941811/vyb9p37rqjyaxxkierzk.jpg,653115e5-54e3-60a2-9b7a-d949c7fb8208,person,John Brigden,"VP, AWS Managed Services",,amazon-web-services,r4wsu8rl4jvpjydbhooy,bd23a50d-2ae3-be33-2a35-383ea9ed13fd,organization,Amazon Web Services,male
bede8e0d-e21f-4e12-8899-c4013e37b284,Matt Wilson,matt-wilson-b284,poib2c4ag8fpzpwbyozw,bede8e0d-e21f-4e12-8899-c4013e37b284,person,Matt Wilson,VP/Distinguished Engineer,"Matt Wilson is a vice president, distinguished engineer at Amazon Web Services, which he joined as a principal systems engineer for the kernel and operating system team. Perviously, he was the chief architect and a founding engineer at rPath, where he codesigned and coauthored Conary, a software version control system, making building and maintaining complex software systems with multiple versions and interdependencies possible. He was responsible for the technical quality of rPath’s products and was instrumental in identifying the needs and solutions for rPath’s most important customers. As one of the first three employees, he had his hands in a little bit of everything at the company. Matt also was the manager of the base operating system team at Red Hat, which he joined as a part time programmer and ended up there full time. His first programming assignment was the maintenance and feature enhancement of the system installer. He was one of the original authors of Anaconda, the installation system used by Red Hat today. As a senior engineer, he lead the team of developers responsible for Anaconda. Matt represented Red Hat as a member of the Linux Standard Base Specification working group. Outside of work, Matt is active in the Linux and free/open source software community. He’s been a member of the Programme Committee of the annual Linux Symposium, traditionally held in Ottawa, Canada, each year. He also served on the board of directors for the Software Freedom Conservancy. The conservancy is a 501©(3) organization providing administrative and financial services to free and open source software projects including Samba, Boost, and jQuery.",amazon-web-services,r4wsu8rl4jvpjydbhooy,bd23a50d-2ae3-be33-2a35-383ea9ed13fd,organization,Amazon Web Services,male
a04828dd-2892-8812-ca6d-c9adecb3ea55,Michael Smith,michael-smith-21,v1464803376/payiy5ts9jdctckjsjl4.png,a04828dd-2892-8812-ca6d-c9adecb3ea55,person,Michael Smith,Head of Startup SAs,Michael Smith Jr. is the Head of Startup SAs at Amazon Web Services (AWS),amazon-web-services,r4wsu8rl4jvpjydbhooy,bd23a50d-2ae3-be33-2a35-383ea9ed13fd,organization,Amazon Web Services,male
7456acd9-383a-6c8f-eb28-fb0ae14d715a,Robert Furnivall,robert-furnivall,v1492859274/cwlwnsccxbgagztz4z3g.jpg,7456acd9-383a-6c8f-eb28-fb0ae14d715a,person,Robert Furnivall,Head of SAP on AWS Partners with Amazon Web Services,,amazon-web-services,r4wsu8rl4jvpjydbhooy,bd23a50d-2ae3-be33-2a35-383ea9ed13fd,organization,Amazon Web Services,male
c06309c6-78e3-f089-4205-abbc6df24de1,Gil Shai,gil-shai,v1453206327/brwdalbtimut8e00zswx.png,c06309c6-78e3-f089-4205-abbc6df24de1,person,Gil Shai,"Head of Business Development, CloudEndure","Gil Shai, formerly CloudEndure’s CRO, possesses an ideal combination of strong technical and managerial skills along with diverse sales and business experience. He was previously the co-founder and COO of AcceloWeb, which was acquired by Limelight Networks, where he then served as VP of Operations. Prior to that, he managed the merger of ApproxiMATCH into Amdocs, where he continued to manage the resulting Amdocs business unit. Gil has over 25 years of leadership experience at startups, large corporations, and the Israeli Air Force, fulfilling senior technical and business roles.",amazon-web-services,r4wsu8rl4jvpjydbhooy,bd23a50d-2ae3-be33-2a35-383ea9ed13fd,organization,Amazon Web Services,male
6a78d4e6-8493-431e-9efa-13655cfd13cb,Lita Sands,lita-sands,py8z0zajp5pxapxa8ckq,6a78d4e6-8493-431e-9efa-13655cfd13cb,person,Lita Sands,Head Global Life Sciences Business Development,"Lita is a Award winning executive with over 20 years of experience in digital & multi-channel marketing with demonstrated success in the Pharmaceutical, Communications and Financial Services industries. Experience in US and Global transformation. Her Track record of building high-performing, sustainable teams through proven leadership and collaboration skills. Practiced in transforming Fortune 50 companies through sophisticated change management expertise.",amazon-web-services,r4wsu8rl4jvpjydbhooy,bd23a50d-2ae3-be33-2a35-383ea9ed13fd,organization,Amazon Web Services,female
d0cebf4e-2b30-48c4-8e6b-77a89ca0de5e,Myles Hosford,myles-hosford,esmm7thwrxuys4fczhsq,d0cebf4e-2b30-48c4-8e6b-77a89ca0de5e,person,Myles Hosford,Principal - Head of Security Architecture ASEAN,"Myles Hosford leads FSI security and compliance engagements for AWS across APAC. He works with some of the region’s largest financial institutions covering banking, insurance and capital markets. Prior to AWS Hosford worked with JP Morgans in Singapore supporting their CIB technology risk engagements. Hosford has also worked in London and Zurich with UBS Investment Bank as a Penetration Tester.

",amazon-web-services,r4wsu8rl4jvpjydbhooy,bd23a50d-2ae3-be33-2a35-383ea9ed13fd,organization,Amazon Web Services,male
5614d365-cb9f-4140-d7c8-371ea9265d61,Soha Hohnecker,soha-hohnecker,v1412144771/xrrfr1eogiw57lyv34u4.jpg,5614d365-cb9f-4140-d7c8-371ea9265d61,person,Soha Hohnecker,Head of EMEA Startup & DNB Marketing,,amazon-web-services,r4wsu8rl4jvpjydbhooy,bd23a50d-2ae3-be33-2a35-383ea9ed13fd,organization,Amazon Web Services,female
743c41a4-170f-524e-fc45-95c19f9dafb7,Alex Mackenzie-Torres,alex-torres,v1475790991/qrdtygfgsjlxw8jroo18.jpg,743c41a4-170f-524e-fc45-95c19f9dafb7,person,Alex Mackenzie-Torres,"Global Head of Market Expansion, GTM",,amazon-web-services,r4wsu8rl4jvpjydbhooy,bd23a50d-2ae3-be33-2a35-383ea9ed13fd,organization,Amazon Web Services,male
c07e9636-91b1-48e9-a677-8fd0332a1c56,Jane Wither,jane-wither,ohqvitdijqnqsrzvbaox,c07e9636-91b1-48e9-a677-8fd0332a1c56,person,Jane Wither,Head of Keynotes & Speaker Programs,,amazon-web-services,r4wsu8rl4jvpjydbhooy,bd23a50d-2ae3-be33-2a35-383ea9ed13fd,organization,Amazon Web Services,female
12444b1b-bf14-9ee0-b5f5-a44110e8b1c2,Nicolas Gresser,nicolas-gresser,v1491647050/jt2adao59jn8ryairqb1.png,12444b1b-bf14-9ee0-b5f5-a44110e8b1c2,person,Nicolas Gresser,Head of Public Policy,,amazon-web-services,r4wsu8rl4jvpjydbhooy,bd23a50d-2ae3-be33-2a35-383ea9ed13fd,organization,Amazon Web Services,male
7ac1f6c1-8b03-7f1f-9084-28b64309376c,Gaurav Arora,gaurav-arora,v1411127641/zogpptwiqjpthbf4c7g5.jpg,7ac1f6c1-8b03-7f1f-9084-28b64309376c,person,Gaurav Arora,"Head of Startup Ecosystem, Asia Pacific and Japan",,amazon-web-services,r4wsu8rl4jvpjydbhooy,bd23a50d-2ae3-be33-2a35-383ea9ed13fd,organization,Amazon Web Services,male
c2f1e2bf-2ab2-9fba-3caa-3027d424a7a3,Kamlesh Bhatia,kamlesh-bhatia,v1507107759/txxcugd1hnz3nfiq0yiv.png,c2f1e2bf-2ab2-9fba-3caa-3027d424a7a3,person,Kamlesh Bhatia,"Head - Digital Innovation, Amazon Internet Services Private Limited (AISPL)",,amazon-web-services,r4wsu8rl4jvpjydbhooy,bd23a50d-2ae3-be33-2a35-383ea9ed13fd,organization,Amazon Web Services,male
ba24304b-c961-f6e4-2940-1bbf6fc842d3,Bill Fine,bill-fine,v1419505483/dqgp9hos6svam8zvuka7.jpg,ba24304b-c961-f6e4-2940-1bbf6fc842d3,person,Bill Fine,"Head of Product, AWS AppSync",,amazon-web-services,r4wsu8rl4jvpjydbhooy,bd23a50d-2ae3-be33-2a35-383ea9ed13fd,organization,Amazon Web Services,male
31c65758-f9b8-4845-be25-7c3823fbae28,David Pellerin,david-pellerin,tlyyf9bkb3zukcpnv3ph,31c65758-f9b8-4845-be25-7c3823fbae28,person,David Pellerin,Head Global Business Development,"David Pellerin serves as Head of Worldwide Business Development for Infotech/Semiconductor at Amazon Web Services. Prior to joining AWS, Mr. Pellerin had a career in electronic design automation and hardware-accelerated reconfigurable computing. He has experience with digital logic simulation and optimization, high-level synthesis, grid and cluster computing, and embedded systems for image, video, and network processing. He has published five Prentice Hall technical books.",amazon-web-services,r4wsu8rl4jvpjydbhooy,bd23a50d-2ae3-be33-2a35-383ea9ed13fd,organization,Amazon Web Services,male
3f4d74a0-d63b-0122-3569-c3043aff6734,Zaheda Bhorat,zaheda-bhorat,v1493699488/exorr8ly2uwqvzqtuhun.png,3f4d74a0-d63b-0122-3569-c3043aff6734,person,Zaheda Bhorat,Head of Open Source Strategy,"Zaheda Bhorat is the head of open source strategy at AWS, where she also leads the open source program office. A computer scientist, Zaheda is a long-time active contributor to open source and open standards communities. Previously, Zaheda shaped the first-ever open source program office at Google, launched successful programs including Google Summer of Code, and represented Google on many industry standards executive boards across multiple technologies; served as a senior technology advisor for the Office of the CTO at the UK Government Digital Service, where she co-led the open standards policy, in use by the UK government on open document formats; and was responsible for OpenOffice.org, and later NetBeans.org, at Sun Microsystems, where she built a thriving global volunteer community and delivered the first user version, OpenOffice 1.0. Zaheda is passionate about education, open source, and the positive impact of collaboration for social good. She serves on the board of directors of the Mifos Initiative, an open source effort that is positioning financial institutions to become digitally connected providers of financial services to the poor, and speaks internationally on topics related to open source.",amazon-web-services,r4wsu8rl4jvpjydbhooy,bd23a50d-2ae3-be33-2a35-383ea9ed13fd,organization,Amazon Web Services,female
2508427d-a84a-9079-6c27-8e27b7e1771e,Zack Jha,swapan-jha,v1494814747/v2kliftoyee9axpqqsjp.png,2508427d-a84a-9079-6c27-8e27b7e1771e,person,Zack Jha,Head of Business Development: Enterprise & Industry Verticals - NE Commercial Sales,,amazon-web-services,r4wsu8rl4jvpjydbhooy,bd23a50d-2ae3-be33-2a35-383ea9ed13fd,organization,Amazon Web Services,male
7ae98f88-fee5-a6b2-efe7-abb98fbe3d36,Rajas Karandikar,rajas-karandikar,v1428731793/efmhrr1ylbzjfvts55rs.png,7ae98f88-fee5-a6b2-efe7-abb98fbe3d36,person,Rajas Karandikar,Head of Mid-Market & SMB,,amazon-web-services,r4wsu8rl4jvpjydbhooy,bd23a50d-2ae3-be33-2a35-383ea9ed13fd,organization,Amazon Web Services,male
ae5293ac-072a-4dcf-bd4a-f5c5be7927cd,Ravi Bagal,ravi-bagal,qgknkkue7dod73nwxqcx,ae5293ac-072a-4dcf-bd4a-f5c5be7927cd,person,Ravi Bagal,"Head, Worldwide Business Development - Retail Industry",,amazon-web-services,r4wsu8rl4jvpjydbhooy,bd23a50d-2ae3-be33-2a35-383ea9ed13fd,organization,Amazon Web Services,male
43f4fb59-b7a6-88eb-0271-981c0ae79c60,Boris Devouge,boris-devouge,v1466630872/v8nahx68nxo4orvhrur5.png,43f4fb59-b7a6-88eb-0271-981c0ae79c60,person,Boris Devouge,Head of Solutions Architecture,,amazon-web-services,r4wsu8rl4jvpjydbhooy,bd23a50d-2ae3-be33-2a35-383ea9ed13fd,organization,Amazon Web Services,male
067a6d6a-ec3d-7d23-b42c-62c86149bf18,Saloni Singh,saloni-singh,v1481081339/zpecfcuay0iwojnywbay.jpg,067a6d6a-ec3d-7d23-b42c-62c86149bf18,person,Saloni Singh,Head of Customer Programs,,amazon-web-services,r4wsu8rl4jvpjydbhooy,bd23a50d-2ae3-be33-2a35-383ea9ed13fd,organization,Amazon Web Services,female
ad5db908-ec58-35b6-0a6e-89c342ef46fb,Nilanshuk Haldar,nilanshuk-haldar,v1463450384/srx4ugsphxbbcgawfh2j.jpg,ad5db908-ec58-35b6-0a6e-89c342ef46fb,person,Nilanshuk Haldar,Head of Financial Services Partnerships,"Head of Financial Services Partners, APAC at AWS.",amazon-web-services,r4wsu8rl4jvpjydbhooy,bd23a50d-2ae3-be33-2a35-383ea9ed13fd,organization,Amazon Web Services,not_provided
43b02801-3750-dedf-cdff-641715d82ef7,Shayan Sanyal,shayan-sanyal,v1397180621/728614be687277f9a1419a66ce466137.jpg,43b02801-3750-dedf-cdff-641715d82ef7,person,Shayan Sanyal,"Head of Game Tech Business Development, EMEA",,amazon-web-services,r4wsu8rl4jvpjydbhooy,bd23a50d-2ae3-be33-2a35-383ea9ed13fd,organization,Amazon Web Services,male
17c485de-6743-c5be-b7f1-32518eceaa39,Jonathan Kaehne,jonathan-kaehne,v1504530177/t91r7qjglabzjuernfbg.png,17c485de-6743-c5be-b7f1-32518eceaa39,person,Jonathan Kaehne,"Head Of Business Development, Australia & New Zealand (ANZ)","Jon leads Amazon Web Services’ Business Development function across Australia and New Zealand, responsible for market and ecosystem development, industry vertical development and customer value acceleration. Jon is passionate about using business and technology innovation to unlock enterprise value. Prior to joining AWS, Jon was a Managing Director at Accenture, and during his 27 year Accenture career held numerous practice and industry vertical leadership positions in Australia and Asia-Pacific, including Innovation Practice Lead for Australia & New Zealand.

Jon holds a Bachelor of Science (Physics) from Monash University, Melbourne and has completed the Advanced Business Management Program (ABMP) at Kellogg Graduate School of Management, Northwestern University, Illinois. Jon has lived and worked in Australia, Asia and the United States, and now lives in Melbourne with his wife Dianne and three daughters.",amazon-web-services,r4wsu8rl4jvpjydbhooy,bd23a50d-2ae3-be33-2a35-383ea9ed13fd,organization,Amazon Web Services,male
35dadcb3-dc52-42e0-ac7a-8f4278010320,Meng-Chow Kang,meng-chow-kang,bmpk0dggyxfmlzojfcnt,35dadcb3-dc52-42e0-ac7a-8f4278010320,person,Meng-Chow Kang,"Head, Security Assurance, Asia Pacific Region","Head of Security Assurance, Asia Pacific at Amazon Web Services​

Meng-Chow Kang is Head of Security Assurance in Asia Pacific Region at Amazon Web Services. He was Director and Chief Information Security Officer of Cisco Systems Asia Pacific, China and Japan from Feb 2009 to June 2017. He’s also one of the board members of ISC2. Besides serving as Convenor, or Chair of the Security Controls and Services Working Group in ISO/IEC JTC 1/SC 27, and a co-Rapporteur for ITU-T SG17 previously, he is also Adjunct Associate Professor at Nanyang Technological University of Singapore.

Dr. Kang received his MSc degree in Information Security from the Royal Holloway and Bedford New College, University of London, and a PhD in Information Security Risk Management at the Southern Cross University, Australia. He has been a Certified Information Systems Security Professional (CISSP) since 1998.

Dr. Kang is author of the CRC Press book Responsive Security: Be Ready to Be Secure.",amazon-web-services,r4wsu8rl4jvpjydbhooy,bd23a50d-2ae3-be33-2a35-383ea9ed13fd,organization,Amazon Web Services,male
cf3880e6-0f5e-6582-e59d-5fa7f35a4266,Ken Krupa,ken-krupa,v1428484511/qp9e7ymcfylv0gvgaaqh.png,cf3880e6-0f5e-6582-e59d-5fa7f35a4266,person,Ken Krupa,"Head of Specialized SA, Compute, the Americas","Ken, Enterprise CTO at MarkLogic, is an executive-level technology professional with over 20 years of professional IT experience, possessing a combination of very strong hands-on technical, interpersonal, business, presentation and management skills. Technical skills cover software application architecture as well as infrastructure design, offering an end-to-end hands-on perspective. Management skills include managing large multi-level teams supporting multiple customers. Interpersonal skills include interaction across a broad spectrum of colleagues from rank-and-file personnel to C-level executives. Experience also includes pre-and-post sales roles with end-customers at all levels, including very strong presentation skills.",amazon-web-services,r4wsu8rl4jvpjydbhooy,bd23a50d-2ae3-be33-2a35-383ea9ed13fd,organization,Amazon Web Services,male
3d4dd438-2a7f-d2f3-893a-951598483c2e,Douglas Lee,douglas-lee-2,v1494582771/gsqjbf1fvdltevd9snec.png,3d4dd438-2a7f-d2f3-893a-951598483c2e,person,Douglas Lee,"Head, Solution Architecture, Strategic ISV Partners","Douglas is a technology leader with 25 years of international experience in professional services, cloud computing, governance, information security and technology management. He has worked in regional and global roles and has lived in Singapore, Japan, Australia and America. He is based in Seattle, and leads a team of Solution Architects at Amazon Web Services (AWS), providing technical evangelism, architectural guidance, knowledge transfer, and cloud implementation guidance to strategic technology partners. Douglas is experienced in distributed systems, networking, cyber security, and identity and access management. He was previously the Regional Head of Solution Architecture, for Asia Pacific and Japan, World-wide Public Sector team at AWS.
Prior to joining AWS, he spent 11 years at Microsoft in roles including APAC head of the Security Center of Excellence (SCOE), Global Director of the Security Technical Community (Worldwide Services), Global Technical Quality Assurance Architect in the CTO Office, and most recently, Lead Architect in Network & Infrastructure, in the Office 365 product team based in Redmond, Washington. He is an active community champion and volunteer. While at Microsoft, he was the Chairman of the Asian Employee Resource (ERG) that represented over 11,000 employees, Chairman of the Singapore Employee Network (EN), and on the advisory committee of the cross company Security Experts group for senior technologist. He was a past-president of the ISACA Singapore chapter, and served as an advisor on the ISACA international conference and education board. His certifications include CISA, CISM, CGEIT (ISACA). He is also a Certified Insurance Professional (CIP) and Senior Associate with the ANZIIF. Prior to joining Amazon, Douglas had various senior roles in the industry for companies such as PricewaterhouseCoopers (Senior Manager), United Overseas Banking Group (Global Head of Technology Audit), Systems Access acquired by Sungard Financials (Chief Security Architect) and UBS AG (APAC Director of Security).",amazon-web-services,r4wsu8rl4jvpjydbhooy,bd23a50d-2ae3-be33-2a35-383ea9ed13fd,organization,Amazon Web Services,male
bfe30d29-16dc-25d1-36f2-129f8d4e9ff4,Rich Heaton,rich-heaton,tqsj3fuqz8qokjtaimbm,bfe30d29-16dc-25d1-36f2-129f8d4e9ff4,person,Rich Heaton,"Head of Software, Neuron Software (Inferentia and Trainium)","Rich Heaton is the Head of Software, Neuron Software (Inferentia and Trainium) at Amazon.",amazon-web-services,r4wsu8rl4jvpjydbhooy,bd23a50d-2ae3-be33-2a35-383ea9ed13fd,organization,Amazon Web Services,male
5fb6fa2d-49d2-92a0-58d7-5441f8e3150d,Barry Evans,barry-evans,eimo4q4mit0cfwnvf6rp,5fb6fa2d-49d2-92a0-58d7-5441f8e3150d,person,Barry Evans,Head of Application Modernization Lab,Barry Evans  is the Head of Application Modernization Lab at  Amazon Web Services.,amazon-web-services,r4wsu8rl4jvpjydbhooy,bd23a50d-2ae3-be33-2a35-383ea9ed13fd,organization,Amazon Web Services,male
7d20bc02-7586-495d-9c63-008215fb2537,Alex Smola,alex-smola,hygajhnv3tlo8xj5hf1s,7d20bc02-7586-495d-9c63-008215fb2537,person,Alex Smola,Distinguished Scientist / VP,,amazon-web-services,r4wsu8rl4jvpjydbhooy,bd23a50d-2ae3-be33-2a35-383ea9ed13fd,organization,Amazon Web Services,male
ccf643f4-d62b-e22c-c401-bfe1f98c3b4b,Petra Wolf,petra-wolf,v1463638980/wjjnbjfegxfqlg4nofab.png,ccf643f4-d62b-e22c-c401-bfe1f98c3b4b,person,Petra Wolf,Head of EMEA Commercial Territory Marketing,,amazon-web-services,r4wsu8rl4jvpjydbhooy,bd23a50d-2ae3-be33-2a35-383ea9ed13fd,organization,Amazon Web Services,female
39c5844f-1cd9-7633-1236-777a5582eb40,Alfonso Amat,alfonso-amat,v1436102720/w3npywa5dj5z36l03wds.jpg,39c5844f-1cd9-7633-1236-777a5582eb40,person,Alfonso Amat,Head of Startup Business Development,,amazon-web-services,r4wsu8rl4jvpjydbhooy,bd23a50d-2ae3-be33-2a35-383ea9ed13fd,organization,Amazon Web Services,male
7bd4d99f-acc0-4e5a-b104-971c3f058971,Lizelle Hughes,lizelle-hughes,df7u7dyuyhctf0dlmlos,7bd4d99f-acc0-4e5a-b104-971c3f058971,person,Lizelle Hughes,Head of Partner Field Engagement,"Lizelle is the leader of the Partner Success Manager team across Australia, and is focused on the success of AWS’s customers and partners driving innovation and ultimately delivering transformative business outcomes. Lizelle is responsible for building out the partner strategy and executing against it with a team of people, who are the quiet achievers behind the success of our Consulting Partners, Technology Partners and Global Systems Integrators – servicing AWS’s most successful customers. 

With over 18 years of experience in various roles – spanning technical consultancy, technical pre-sales, product marketing, strategy, sales, technology partnerships and channel, Lizelle is passionate about the long term success of the Australian ICT channel – and how they evolve to continually deliver customer outcomes.",amazon-web-services,r4wsu8rl4jvpjydbhooy,bd23a50d-2ae3-be33-2a35-383ea9ed13fd,organization,Amazon Web Services,female
b466c0d4-18d7-af34-820f-33ce9ea4c355,Adi Krishnan,adi-krishnan,v1461313724/xmj0phlynwftw9qkxosj.jpg,b466c0d4-18d7-af34-820f-33ce9ea4c355,person,Adi Krishnan,Head of Amazon Kinesis Data and Video Streams,,amazon-web-services,r4wsu8rl4jvpjydbhooy,bd23a50d-2ae3-be33-2a35-383ea9ed13fd,organization,Amazon Web Services,male
d6ff537a-2d32-aad5-89be-252474bbf895,Keran McKenzie,keran-mckenzie,v1423628814/naptuawj8ubpvsy8uv47.jpg,d6ff537a-2d32-aad5-89be-252474bbf895,person,Keran McKenzie,Head of Software Partners,,amazon-web-services,r4wsu8rl4jvpjydbhooy,bd23a50d-2ae3-be33-2a35-383ea9ed13fd,organization,Amazon Web Services,male
ff22025c-77bd-7ce9-fa7f-8b43cf3694dc,Adrian Cockcroft,adrian-cockcroft,v1455085312/lkpldcrbpglhqd5nnd0f.png,ff22025c-77bd-7ce9-fa7f-8b43cf3694dc,person,Adrian Cockcroft,Vice President Cloud Architecture Strategy,,amazon-web-services,r4wsu8rl4jvpjydbhooy,bd23a50d-2ae3-be33-2a35-383ea9ed13fd,organization,Amazon Web Services,male
b9a58faa-c5cf-4e13-90f4-5143f353f36d,David Holladay,david-holladay,eomqgkqdygiobacuqcqc,b9a58faa-c5cf-4e13-90f4-5143f353f36d,person,David Holladay,Head of AWS Game Tech Marketing,,amazon-web-services,r4wsu8rl4jvpjydbhooy,bd23a50d-2ae3-be33-2a35-383ea9ed13fd,organization,Amazon Web Services,male
