uuid,properties.name,properties.identifier.permalink,properties.identifier.image_id,properties.identifier.uuid,properties.identifier.entity_def_id,properties.identifier.value,properties.primary_job_title,properties.description,properties.primary_organization.permalink,properties.primary_organization.image_id,properties.primary_organization.uuid,properties.primary_organization.entity_def_id,properties.primary_organization.value,properties.gender
fd543302-4bac-c85d-2683-3ed6565966ee,Sanjay Poonen,sanjay-poonen,jfdm1env1bun4seylcbe,fd543302-4bac-c85d-2683-3ed6565966ee,person,Sanjay Poonen,"Chief Operating Officer, Customer Operations","Sanjay Poonen joined VMware in August 2013, and is responsible for worldwide sales, services, alliances, marketing and communications. Previously, Poonen held the role of executive vice president and general manager for the End-User Computing business unit at VMware. In this role, he was responsible for strategy, products, engineering, marketing and sales across all of VMware's End-User Computing offerings. 

Before VMware, Poonen was president and corporate officer of Platform Solutions and the Mobile Division at SAP AG. During his more than seven years at SAP, Poonen held several executive-level roles in product development and sales, including leading SAP’s Analytics, Big Data, Mobile and all Industry Business Units, driving many solutions to industry-leading market positions. 

Prior to SAP, Poonen held executive roles at Symantec, VERITAS and Informatica, and he began his career as a software engineer at Microsoft, followed by Apple. Poonen serves on the Board of Directors of Infor and the Advisory Board of Docusign. 

Poonen holds two patents as well as an MBA from Harvard Business School, where he graduated a Baker Scholar; a master's degree in management science and engineering from Stanford University; and a bachelor's degree in computer science, math and engineering from Dartmouth College, where he graduated summa cum laude and Phi Beta Kappa.",vmware,qxriqfhypeuyosqwritt,fb1e0239-94df-a94c-56d9-28956a629ed9,organization,VMware,male
69cc2102-f22f-d9fb-38d5-f7cdd6ce5b05,Edward Wang,edward-wang,v1490939138/rsvbpnwqawsl6lzdm0fh.jpg,69cc2102-f22f-d9fb-38d5-f7cdd6ce5b05,person,Edward Wang,Co-Founder,"Dr. Edward Wang, Co-Founder and serves as Principal Engineer of Vmware, Inc. Dr. Wang has 10+ years of high tech industry experience. Prior to joining VMware, he worked as a principal engineer at VXtreme and Mindcraft and has consulted extensively on UNIX software projects. In 1993, he received a Lifetime Achievement Award from Usenix for his contributions to the development of Berkeley UNIX. 

He also helped to neutralize the infamous Internet Worm virus by discovering and describing one of its key mechanisms. 

He holds Ph.D. and M.S. degrees in computer science and a B.S. in electrical engineering and computer science from the University of California at Berkeley.",vmware,qxriqfhypeuyosqwritt,fb1e0239-94df-a94c-56d9-28956a629ed9,organization,VMware,male
4fccc5ea-4276-4444-8157-b7b4ead61f65,Jayanta Dey,jayanta-dey,bgl8rdaqxhpou53vurkf,4fccc5ea-4276-4444-8157-b7b4ead61f65,person,Jayanta Dey,"VP Engineering, Cloud Foundation and Integrated Systems",Jayanta Dey serves as vice president of engineering for Cloud Foundation and Integrated Systems at VMware.,vmware,qxriqfhypeuyosqwritt,fb1e0239-94df-a94c-56d9-28956a629ed9,organization,VMware,male
11824886-05ac-4bd1-879e-af6f9480fed2,Zane Rowe,zane-rowe,xkcznvooa6squrrxr4ot,11824886-05ac-4bd1-879e-af6f9480fed2,person,Zane Rowe,Chief Financial Officer and Executive Vice President,"Mr. Rowe has served as a member of our board of directors since September 2016. Mr. Rowe has served as Chief Financial Officer and Executive Vice President of VMware since March 2016. Before joining VMware, he served as Executive Vice President and Chief Financial Officer of DellEMC from October 2014 through February 2016. Prior to joining DellEMC, Mr. Rowe was Vice President of North American Sales of Apple Inc. from May 2012 to May 2014. He was Executive Vice President and Chief Financial Officer of United Continental Holdings, Inc., an airline holdings company, from October 2010 until April 2012 and was Executive Vice President and Chief Financial Officer of Continental Airlines from August 2008 to September 2010. Mr. Rowe currently serves on the board of directors of Sabre Corporation.",vmware,qxriqfhypeuyosqwritt,fb1e0239-94df-a94c-56d9-28956a629ed9,organization,VMware,male
70537d59-51cf-ea61-e86c-96d83359cb53,Scott Devine,scott-devine,,70537d59-51cf-ea61-e86c-96d83359cb53,person,Scott Devine,Co-Founder,"Scott Devine, Co-Founder and serves as Principal Engineer of Vmware, Inc. Dr. Devine, primary research interests are in operating systems and computer architectures, and he was a key member of the SimOS and Disco virtual machine research teams. 

Dr. Devine was a Ph.D. candidate in computer science at Stanford University prior to co-founding VMware. He holds a B.S. from Cornell University and an M.S. from Stanford University.",vmware,qxriqfhypeuyosqwritt,fb1e0239-94df-a94c-56d9-28956a629ed9,organization,VMware,male
e73d3340-0390-2317-a854-393568ed5f0c,Raghu Raghuram,raghu-raghuram,v1397184833/482778001c0e29cbff294b10d1c3b2fe.png,e73d3340-0390-2317-a854-393568ed5f0c,person,Raghu Raghuram,CEO,"Raghu Raghuram joined VMware in 2003 and leads the company's cloud infrastructure and management business, bringing more than 25 years of technology experience. During his tenure at VMware, Raghuram has held multiple roles in product management and product marketing, most recently leading worldwide product marketing, product management and business planning for VMware's virtual infrastructure, SMB and emerging markets businesses, as well as shared product marketing services.

Prior to VMware, Raghuram held product management and marketing roles at AOL, Bang Networks and Netscape. Raghuram holds an MBA from the Wharton School of Business and a master's degree in electrical engineering from the Indian Institute of Technology, Bombay.",vmware,qxriqfhypeuyosqwritt,fb1e0239-94df-a94c-56d9-28956a629ed9,organization,VMware,male
dc28b01f-7dd2-db3b-884d-6cf25db35d5e,Mendel Rosenblum,mendel-rosenblum,v1398425114/ezjkknlrebo9dnyohygv.jpg,dc28b01f-7dd2-db3b-884d-6cf25db35d5e,person,Mendel Rosenblum,Co-Founder,"Mendel Rosenblum is a co-founder of [VMware](https://www.crunchbase.com/organization/vmware), a software company that provides cloud and virtualization services. Previously, he was an accountant at Better Accounting Solutions.",vmware,qxriqfhypeuyosqwritt,fb1e0239-94df-a94c-56d9-28956a629ed9,organization,VMware,male
025f1bad-a1d9-ec3c-f8ec-4a75f3374c5d,Vittorio Viarengo,vittorio-viarengo,v1493278634/bz1tj7rkqvedr5u5i1wi.png,025f1bad-a1d9-ec3c-f8ec-4a75f3374c5d,person,Vittorio Viarengo,Vice President of Cross-Cloud Services,"Vittorio Viarengo brings more than 30 years of experience in building and leading world-class product management, engineering and marketing teams tuned to succeed in fast growing markets. Vittorio currently serves as the Vice President of Cross-Cloud Services at VMware where he drives the thought leadership and go-to-market strategy for VMware Cross-Cloud Services.

Prior to VMware, Vittorio was the interim CMO of McAfee after running marketing for McAfee’s Cloud Business Unit, the division built around the Skyhigh Networks acquisition where he was the Chief Marketing Officer, responsible for corporate marketing, communication, product marketing and demand generation. 

Prior to Skyhigh, Vittorio was the CMO and VP of Products at MobileIron, during the explosive growth years between 2012-2015, when revenues went from $40 million to $132 million. At MobileIron, Vittorio was also part of the core leadership team that took the company public in 2014. 

Prior to MobileIron, Vittorio served in increasing levels of responsibility across product management and marketing at VMware Inc. Most recently, Vittorio led the End-User Computing Division as Vice President of Marketing, where he played a key role in putting VMware’s Virtual Desktop Infrastructure (VDI) on a fast-growth trajectory and giving VMware a compelling vision for the End User Computing business. 

Vittorio also held executive engineering and product management positions at Oracle’s Fusion Middleware Division, BEA Systems and Object Design Inc. 
Vittorio started his career as the Founder and Chief Executive Officer of ViVi Software Inc., a company that created visual development tools for object databases, from its start until its acquisition by Object Design in1997. 

Vittorio holds a B.A. in Software Engineering from Universita’ degli Studi di Genova, Italy.",vmware,qxriqfhypeuyosqwritt,fb1e0239-94df-a94c-56d9-28956a629ed9,organization,VMware,male
32fc6d73-017d-16b7-b677-7271011094db,Maurizio Carli,maurizio-carli,v1397184723/6a1a53a40438f1b92941f9e38fbb1979.png,32fc6d73-017d-16b7-b677-7271011094db,person,Maurizio Carli,"Senior Vice President and General Manager, Europe, Middle East and Africa (EMEA)","Maurizio Carli joined VMware in December 2008 and manages the Europe, Middle East and Africa (EMEA) region to drive growth and oversee strategic planning, business operations and the management of key functions including sales, channels, services and marketing, bringing nearly 30 years of IT industry experience. Prior to VMware, Carli worked on a short-term assignment at Google and spent five years at Business Objects, where as senior vice president and general manager, EMEA, he was responsible for sales, pre-sales, marketing, finance, customer support and global services. Until 2002, Carli spent 19 years at IBM, most recently as vice president of Software for IBM EMEA. Overseeing a 5,000-strong division, he led IBM's software portfolio in the region including sales, marketing, technical support, finance and human resources. Previously, Maurizio was vice president and general manager for IBM’s Tivoli Systems Division, and also held sales and sales management positions in the government, education and healthcare sectors for IBM Italy. Maurizio holds a BSC in electronic engineering from the Politecnico di Milano in Italy.",vmware,qxriqfhypeuyosqwritt,fb1e0239-94df-a94c-56d9-28956a629ed9,organization,VMware,male
6b87c4ce-5fcf-9e92-3629-b63e2d885227,Sanjay Uppal,sanjay-uppal,lpg60nh6t6uum0m7k75r,6b87c4ce-5fcf-9e92-3629-b63e2d885227,person,Sanjay Uppal,VP & GM VeloCloud Business Unit,"Sanjay is the CEO and co-founder of VeloCloud where he leads the team that is working to Re-Invent WAN and transform how businesses connect. Prior to VeloCloud, Sanjay ran publicly traded OnMobile Global, serving as its President and COO. Sanjay also spent time at Citrix through the acquisition he negotiated with Caymas where he was President and CEO. At Citrix, he defined the product strategy and go to market for the Access Management, Delivery Controller and WAN acceleration product lines. 

Prior, Sanjay served in executive roles at Webvan (Vice President of Engineering and Business Development) and at Hewlett-Packard where he initiated and rapidly grew Internet Infrastructure as a profitable new business for HP. He holds an MS from Stanford University, an MS from the University of Wisconsin, and a BS in Electrical Engineering from The Indian Institute of Technology",vmware,qxriqfhypeuyosqwritt,fb1e0239-94df-a94c-56d9-28956a629ed9,organization,VMware,male
0e5096e4-a557-4d80-bfd1-5b0ab5879a93,Sandeep Poonen,sandeep-poonen,lzqrkswxlwhipy15joov,0e5096e4-a557-4d80-bfd1-5b0ab5879a93,person,Sandeep Poonen,"Information Security Officer, Cloud Services","Sandeep serves as Information Security Officer for all VMware Cloud Services. He partners with engineering teams and executives to develop short- and long-term security, product and service strategies. Previously, he was West Coast Lead, GRC and Analytics at PwC. There, he solved clients' security challenges such as open vulnerabilities, segregation of duties issues, and access violations through integration of best-in-class security objectives into business processes without affecting operational efficiency.",vmware,qxriqfhypeuyosqwritt,fb1e0239-94df-a94c-56d9-28956a629ed9,organization,VMware,male
676b4099-7fb7-7caa-fc86-c3010f06fa58,Sumit Dhawan,sumit-dhawan,v1485750802/q59ynexxwlsdmcze1zpi.png,676b4099-7fb7-7caa-fc86-c3010f06fa58,person,Sumit Dhawan,President,Sumit Dhawan is the President of VMware. Attended Stanford University Graduate School of Business.,vmware,qxriqfhypeuyosqwritt,fb1e0239-94df-a94c-56d9-28956a629ed9,organization,VMware,male
26989c99-3c83-51cf-61f1-0e57b2d48e19,Kit Colbert,kit-colbert,v1433995352/hsvsy0m4arlfihqcuwt2.png,26989c99-3c83-51cf-61f1-0e57b2d48e19,person,Kit Colbert,Chief Technology Officer,Kit Colbert is the Chief Technology Officer at VMware. He attended Brown University.,vmware,qxriqfhypeuyosqwritt,fb1e0239-94df-a94c-56d9-28956a629ed9,organization,VMware,male
25e330b2-b303-f0ff-3a58-3214d9233e5b,Tanya Shastri,tanya-shastri,,25e330b2-b303-f0ff-3a58-3214d9233e5b,person,Tanya Shastri,"Vice President of Products,",Tanya Shastri is the Vice President of Products at VMware.,vmware,qxriqfhypeuyosqwritt,fb1e0239-94df-a94c-56d9-28956a629ed9,organization,VMware,female
562c34a2-31aa-b5fe-7b6f-a19507de823f,Tom Gillis,tom-gillis,v1414010993/j49xwntjeldsoiz8rowp.jpg,562c34a2-31aa-b5fe-7b6f-a19507de823f,person,Tom Gillis,"Senior Vice President and General Manager, Network and Security","Tom Gillis is CEO of Bracket Computing, a company he founded in December 2011. Gillis started Bracket with a vision to re-imagine enterprise computing. Before starting Bracket, Gillis was VP/GM of the Security Technology Group at Cisco Systems. This Technology Group included the business units responsible for Cisco's entire Network and Content Security product portfolio, including firewalls, IPS, VPN, and email security and web security gateways. Prior to Cisco, Tom was VP of Marketing and part if the founding team of IronPort Systems which was acquired by Cisco in 2007. Before that, he held the position of VP/GM at iBEAM Broadcasting, an Internet start up that wentpublic on NASDAQ. He has also worked at Silicon Graphics, the Boston Consulting Group, and Raytheon Corporation. Gillis received a BSEE from Tufts, an MSEEfrom Northwestern, and an MBA from Harvard.",vmware,qxriqfhypeuyosqwritt,fb1e0239-94df-a94c-56d9-28956a629ed9,organization,VMware,male
9378d286-410e-a37c-e903-41a4a14fb50c,Ricky Cooper,ricky-cooper,v1434621357/ermm5abem12jggrn1jf1.png,9378d286-410e-a37c-e903-41a4a14fb50c,person,Ricky Cooper,WW Vice President & GM,Ricky Cooper is the Vice President & GM WW DSAT at VMware. He attended the University of Oxford.,vmware,qxriqfhypeuyosqwritt,fb1e0239-94df-a94c-56d9-28956a629ed9,organization,VMware,male
9a872490-624a-b98b-e29e-aa6dcf9871af,Pere Monclus,pere-monclus,v1436784764/qmxg1cs2csdymofrvlwx.png,9a872490-624a-b98b-e29e-aa6dcf9871af,person,Pere Monclus,VP & CTO Network and Security BU,"Pere Monclus is the VP & CTO of Network and Security BU at VMware. Additionally, Pere Monclus has had 1 past job as the Founder and CTO at PLUMgrid.",vmware,qxriqfhypeuyosqwritt,fb1e0239-94df-a94c-56d9-28956a629ed9,organization,VMware,male
3f9d3a36-4ca3-4d63-f17e-a59875b51a34,Shiv Agarwal,shiv-agarwal-2,v1415650350/kbxubxwnggi5ng2pfqfn.jpg,3f9d3a36-4ca3-4d63-f17e-a59875b51a34,person,Shiv Agarwal,VP/GM,Shiv Agarwal is the VP and GM at VMware. He attended The Wharton School.,vmware,qxriqfhypeuyosqwritt,fb1e0239-94df-a94c-56d9-28956a629ed9,organization,VMware,male
b8ea2f60-dcb5-f4ea-d790-1b6666f3e14e,Andrew Dutton,andrew-dutton,v1397184800/3e034ef11519b962cb93bf2553debf13.jpg,b8ea2f60-dcb5-f4ea-d790-1b6666f3e14e,person,Andrew Dutton,Senior Vice President and General Manager VMware Asia Pacific & Japan,"Andrew Dutton leads VMware’s Asia Pacific and Japan region as Senior Vice President and General Manager. Andrew is responsible for strategic planning, business development and management of key functions for the region, including sales, channels, services, finance and marketing.

Andrew brings more than 28 years of global management and sales experience across various industries, including IT and financial services. Prior to VMware, Andrew was at Computer Associates (CA) where he was Senior Vice President and General Manager of International Business, responsible for sales and business operations throughout the Europe, Middle East & Africa (EMEA) and Asia Pacific & Japan (APJ) regions.

Prior to CA, Andrew was Senior Vice President and General Manager for BEA Systems EMEA. Earlier, Andrew spent 17 years at IBM in several different senior management positions. As Vice President and General Manager for IBM Software Group Asia Pacific based in Tokyo, Andrew had responsibility for more than 3,000 software sales, marketing and support personnel across the region.

Andrew holds a Bachelor of Science degree from Sydney University.",vmware,qxriqfhypeuyosqwritt,fb1e0239-94df-a94c-56d9-28956a629ed9,organization,VMware,male
f1e7716b-93a9-471f-b5bd-ea4db4dcbacb,Kathy Chou,kathy-chou,ha1pt2bjq74onxgif1y3,f1e7716b-93a9-471f-b5bd-ea4db4dcbacb,person,Kathy Chou,"VP, R&D Operations and Central Services","Kathy Chou is VP of Research & Development Operations and Central Services for VMware. Chou has more than 25 years of operations and management experience in the high-tech industry. Previously, she has served as SVP of Sales Strategy and Operations for Informatica, VP of Sales Operations and Strategy at Intuit and spent 18 years at HP in various management roles. Chou holds a bachelor’s degree in mechanical engineering and a master’s degree in manufacturing systems engineering from Stanford University, and an MBA from the Harvard Graduate School of Business. She most recently served on the Stanford Presidential Search Committee, has chaired the Stanford Alumni Committee on Trustee Nominations and served on the Alumni Association Board of Directors. She is currently Vice Chair for the Stanford Institute for Research in Social Sciences (IRISS), development director for the Asian Pacific Fund, member of the Santa Clara University Board of Regents and Engineering Advisory Board. Kathy received the Stanford Medal in 2013, Wise Woman Award from Deloitte LLP in 2011, and was the Winner of the Franz Edelman Award for excellence in Operations Research in 2009. The Silicon Valley Business Journal selected her as one of the Top 100 most influential women in 2011. Chou lives in the San Francisco Bay Area with her husband and four sons.",vmware,qxriqfhypeuyosqwritt,fb1e0239-94df-a94c-56d9-28956a629ed9,organization,VMware,female
29a55316-6082-5766-87ae-905557e2a1d6,Chris Wolf,chris-wolf,v1440256329/ffnngmptpfayxba3jg3b.png,29a55316-6082-5766-87ae-905557e2a1d6,person,Chris Wolf,Chief Research and Innovation Officer,"Chris Wolf is the CTO, Americas at VMware. Chris serves as a partner and trusted adviser to VMware's customers in the Americas, and also collaborates with the IT and business community at large on cloud, mobile, virtualization and data center modernization strategies. Chris and his peers in the Office of the CTO work closely with VMware's product teams to ensure that VMware's future innovations align with essential market needs.",vmware,qxriqfhypeuyosqwritt,fb1e0239-94df-a94c-56d9-28956a629ed9,organization,VMware,male
1635b5d6-938f-4b46-8bfa-5bc295455512,Ajay Patel,ajay-patel-5512,y4axwxubmhvvebb8a4ac,1635b5d6-938f-4b46-8bfa-5bc295455512,person,Ajay Patel,SVP/GM Cloud Provider,"Ajay Patel is senior vice president of Product Development, Cloud Services, responsible for all product development and operations for vCloud Air.

 

Prior to VMware, Ajay led the core middleware business, Cloud Application Foundation, for Oracle. Under his leadership, Oracle Exalogic, a middleware engineered system, became the fastest-growing business and Oracle WebLogic, a Java EE Application Server, was #1 in the market during his entire tenure. He also launched Oracle Java Cloud Service and set the roadmap for Oracle’s private cloud solution.

 

Ajay has over 20 years of enterprise software expertise and was also senior vice president at Apigee (Sonoa Systems) and general manager for BEA Systems, Data Services business. His prior experience includes management consulting and system integration with Price Waterhouse Coopers, EDS and AT&T. He holds a Bachelors of Science in Electrical Engineering and another Bachelor of Science in Computer Science from University of California, Irvine. He is also a technical adviser to venture funded software companies.",vmware,qxriqfhypeuyosqwritt,fb1e0239-94df-a94c-56d9-28956a629ed9,organization,VMware,male
0db98ef9-10ce-ce85-0ca3-6f05874a4294,Allwyn Sequeira,allwyn-sequeira,sxdqcjpugidzxc64ovqe,0db98ef9-10ce-ce85-0ca3-6f05874a4294,person,Allwyn Sequeira,"SVP & GM, Hybrid Cloud Services BU",Allwyn Sequeira serves as senior vice president and general manager for Hybrid Cloud Services BU at VMware.,vmware,qxriqfhypeuyosqwritt,fb1e0239-94df-a94c-56d9-28956a629ed9,organization,VMware,male
60574a2c-4a17-d6c2-ccd6-ac781dcd4570,Andy Banks,andy-banks,v1444545358/qtk2sk08vrvfsjhrdwip.jpg,60574a2c-4a17-d6c2-ccd6-ac781dcd4570,person,Andy Banks,Vice President of Global Distribution,Andy Banks is a Vice President of Global Distribution at VMware.,vmware,qxriqfhypeuyosqwritt,fb1e0239-94df-a94c-56d9-28956a629ed9,organization,VMware,male
8fc2a134-8cbf-4ad9-a042-782b433a85c8,June Yang,june-yang,gdijosulfcb1uygksbjw,8fc2a134-8cbf-4ad9-a042-782b433a85c8,person,June Yang,"Vice President, Engineering and Product Management - VMware cloud on Dell EMC",June Yang serves as vice president of engineering and product management at VMware.,vmware,qxriqfhypeuyosqwritt,fb1e0239-94df-a94c-56d9-28956a629ed9,organization,VMware,female
c3e4a85c-1d13-bd0c-3b23-58893579986b,Sanjay Katyal,sanjay-katyal,v1461315816/lnbsccfydduwg6azxnpx.jpg,c3e4a85c-1d13-bd0c-3b23-58893579986b,person,Sanjay Katyal,"Global Vice President, Business Development and Partner Sales, Integrated Systems Business Unit",,vmware,qxriqfhypeuyosqwritt,fb1e0239-94df-a94c-56d9-28956a629ed9,organization,VMware,male
8134c8d4-b412-79ea-9f56-d43a90d2cfd1,Paul Turner,paul-turner-2,v1408481750/k3zri0mha0te23ygqm5o.jpg,8134c8d4-b412-79ea-9f56-d43a90d2cfd1,person,Paul Turner,Vice President Product Management vSphere,"Paul Turner is the Chief Marketing Officer at Cloudian Inc. since January 2014. Paul is responsible for marketing, product planning and strategy at Cloudian. 

A storage industry expert, Paul previously led the Product Strategy Office at NetApp, where he guided their investments into FlashRay, Iongrid and CacheIQ. 

Prior to that role, Paul was the General Manager of the OnCommand Insight Business (which included Onaro and Akorri). Under his leadership this enterprise software business grew to more than $60M and was recognized by Gartner as a leader in the Storage Resource Management market. 

Paul has more than 23 years of development and management leadership, including 15 years at Oracle where he led Oracle's Technology Alliances Division and their Support Engineering Team. 

Paul holds a Bachelor's degree in Computer Science from Trinity College, Dublin, Ireland and is based out of Cloudian's Foster City, Calif. headquarters.",vmware,qxriqfhypeuyosqwritt,fb1e0239-94df-a94c-56d9-28956a629ed9,organization,VMware,male
4da6f8f3-5363-44d8-bf6c-1c9f9181cc36,Hüseyin Dursun,hüseyin-dursun,k9droihuuufxamx3hnnv,4da6f8f3-5363-44d8-bf6c-1c9f9181cc36,person,Hüseyin Dursun,Vice President of Engineering & Head of VMware Engineering Services,Hüseyin Dursun is the Vice President of Engineering & Head of VMware Engineering Services at VMware.,vmware,qxriqfhypeuyosqwritt,fb1e0239-94df-a94c-56d9-28956a629ed9,organization,VMware,male
5ee7987b-bd47-b39c-d6e3-f3bcaf550328,Joe Baguley,joe-baguley,v1433420016/qo1m3oqdpv6kuxdqgily.png,5ee7987b-bd47-b39c-d6e3-f3bcaf550328,person,Joe Baguley,"Vice President and Chief Technology Officer, EMEA","Joe Baguley is VMware’s Vice President and Chief Technology Officer for EMEA. He joined VMware in July 2011 and helps develop and communicate VMware’s strategy and vision with customers and partners, using his wealth of experience to help organisations reduce costs and better support users and business needs. As part of VMware’s Office of the CTO and its representative in EMEA, Joe assists VMware’s customers in understanding how to use today’s advances in technology to deliver real business impact as well as working with them to inform VMware’s R&D processes.

Joe is a recognised leader within the European technical community and is considered one of the world’s most influential IT global leaders, currently positioned 26th on Tenfold’s global list of the top 79 Chief Technology Officers. He has played a key role in CloudCamp and other events, communicating how cloud technology fits into the broader IT landscape. He is a regular commentator on BBC World News, last appearing in January 2018 talking about edge computing with Aaron Heslehurst on Talking Business.

In addition, Joe is also on several advisory boards at the European Commission and ETSI and is a founding committee member of the Data Centre Specialist Group at the British Computer Society which helped shape the European Code of Conduct for Data Centres.
",vmware,qxriqfhypeuyosqwritt,fb1e0239-94df-a94c-56d9-28956a629ed9,organization,VMware,male
98e4cdfb-1ff8-46af-b61d-0d977912a7df,Ramkumar Narayanan,ramkumar-narayanan,jm1bz1ftoyzpzbx42mrc,98e4cdfb-1ff8-46af-b61d-0d977912a7df,person,Ramkumar Narayanan,VP Technology & Managing Site Director,Ramkumar Narayanan serves as the Vice President of Technology and Managing Site Director at VMware.,vmware,qxriqfhypeuyosqwritt,fb1e0239-94df-a94c-56d9-28956a629ed9,organization,VMware,male
