uuid,properties.name,properties.identifier.permalink,properties.identifier.image_id,properties.identifier.uuid,properties.identifier.entity_def_id,properties.identifier.value,properties.primary_job_title,properties.description,properties.primary_organization.permalink,properties.primary_organization.image_id,properties.primary_organization.uuid,properties.primary_organization.entity_def_id,properties.primary_organization.value,properties.gender
c4fce884-eb80-322a-aec5-2356cf20c183,Nathan Richardson,nathan-richardson,v1433523236/gxhzolvtwr6hn5nvzaqh.png,c4fce884-eb80-322a-aec5-2356cf20c183,person,Nathan Richardson,EVP,EVP at Red Ventures.,red-ventures,v1455217906/n6znj8vxg1vgfdb4tomh.jpg,e0a75ec2-43d3-5dec-5729-3a6825c8325a,organization,Red Ventures,male
9b2f5696-b7ae-160e-8120-b6294a1f0843,Tim Kullick,tim-kullick,v1397181752/bd56e1559b5ad0df974b28f1abf44e21.jpg,9b2f5696-b7ae-160e-8120-b6294a1f0843,person,Tim Kullick,Chief Operating Officer,"Tim Kullick runs the Insurance division of Red Ventures and also works on new business development. He previously led Red Ventures’ paid and natural search marketing practice areas. 

Prior to joining Red Ventures, Tim owned and operated a chain of home improvement franchises specializing in bathroom remodeling. While taking the business from startup to four locations in five years, he also provided strategy and operations consulting services to several retailers, retail industry vendors, and private equity firms with retail industry holdings. 

Prior to launching his own business, Tim held leadership roles in strategic planning, e-commerce, and home services at The Home Depot, the world's largest home improvement retailer. He also spent 6 years advising senior leadership of Fortune 500 companies as a strategy consultant with McKinsey & Company. 

Tim graduated from the University of Colorado, summa cum laude, and earned his MBA from Harvard Business School.",red-ventures,v1455217906/n6znj8vxg1vgfdb4tomh.jpg,e0a75ec2-43d3-5dec-5729-3a6825c8325a,organization,Red Ventures,male
43956da6-db3d-ebcd-180a-ded2204dc5a3,Shannon McFayden,shannon-mcfayden,v1397181750/53f9291d049b0bd44533fc72ada3ba1c.jpg,43956da6-db3d-ebcd-180a-ded2204dc5a3,person,Shannon McFayden,Chief Diversity & Inclusion Officer,"Shannon has been with Red Ventures since January of 2011. Her work at RV focuses on company culture, leadership effectiveness and talent management. 

Prior to joining Red Ventures, Shannon was Executive Vice President and Head of Human Resources & Corporate Relations for Wachovia Corporation, the nation's 4th largest financial institution in 2008, with $764 billion in assets and 120,000 employees globally. 

In this role, she provided leadership for Human Resources, Corporate Communications, Community Relations and Marketing. Named as one of the ""25 Most Powerful Women in Banking"" by US Banker, Shannon has also been recognized with the United Negro College Fund's ""Maya Angelou Women Who Lead"" Award, the Thurgood Marshall College Fund's ""Award of Excellence"", and the Dress for Success ""Paradigm Award"". 

Shannon graduated cum laude with a Bachelor of Arts in Psychology from Davidson College. She and her husband of 27 years, Greg, live in Charlotte and have two daughters, ages 20 and 17.",red-ventures,v1455217906/n6znj8vxg1vgfdb4tomh.jpg,e0a75ec2-43d3-5dec-5729-3a6825c8325a,organization,Red Ventures,female
3f14ad0c-7952-9a88-1f92-ebed34448c09,Steven Sibley,steven-sibley,v1397181753/32cab1200f10a308621e5dbf3948a9db.jpg,3f14ad0c-7952-9a88-1f92-ebed34448c09,person,Steven Sibley,President - RV Travel,,red-ventures,v1455217906/n6znj8vxg1vgfdb4tomh.jpg,e0a75ec2-43d3-5dec-5729-3a6825c8325a,organization,Red Ventures,male
a6d3f9f3-9b5c-0fdd-cbbc-a6bf42e245ee,John Sutton,john-sutton,v1397181756/ea463f3b7adfd1ebe69d9cc1d57ecb8c.jpg,a6d3f9f3-9b5c-0fdd-cbbc-a6bf42e245ee,person,John Sutton,President & Chief Digital Officer,"John Sutton currently serves as Chief Digital Officer and President of Red Ventures; responsible for leading Digital Media including paid search, SEO, Programmatic Display, Social, and other digital practices for Red Ventures and it's many partners. In addition, John is responsible for new technology development, investments, and acquisitions; including recent innovations in online to offline and cross-device tracking technologies, development of omni-channel messaging solutions, and bespoke technology solutions for partner-driven and principal businesses at Red Ventures across the globe.

Prior to joining Red Ventures, John owned and operated his own internet marketing consulting firm where he provided marketing strategy, agency contract negotiation and hands-on management of search marketing initiatives for several large organizations. He also served as Director of Internet Marketing for Career Education Corporation, a large for-profit education company based outside of Chicago, IL.

John attended Indiana University’s Kelley School of Business.",red-ventures,v1455217906/n6znj8vxg1vgfdb4tomh.jpg,e0a75ec2-43d3-5dec-5729-3a6825c8325a,organization,Red Ventures,male
06ee3ac1-e0f4-9826-d2c4-763dd01336fb,Austin Hulak,austin-hulak,iyabxzibufzptgn5pqyp,06ee3ac1-e0f4-9826-d2c4-763dd01336fb,person,Austin Hulak,Vice President Of Product Management,"I'm passionate about technology, it's intersection with consumer finance and the resulting products that are changing the financial landscape.

I'm currently building technology that helps consumers discover opportunities for financial optimization.",red-ventures,v1455217906/n6znj8vxg1vgfdb4tomh.jpg,e0a75ec2-43d3-5dec-5729-3a6825c8325a,organization,Red Ventures,male
4bebb107-e369-1fc8-b3c2-16d5243d1d9c,Rodney Sims,rodney-sims,v1455218472/zoqlegbcxj2u5feiprrz.jpg,4bebb107-e369-1fc8-b3c2-16d5243d1d9c,person,Rodney Sims,President,,red-ventures,v1455217906/n6znj8vxg1vgfdb4tomh.jpg,e0a75ec2-43d3-5dec-5729-3a6825c8325a,organization,Red Ventures,male
0c35cba7-e824-54b6-6f9f-f43151013b80,Michael Elkins,michael-elkins-2,v1495680969/puqhrygfuk63nihesnhe.png,0c35cba7-e824-54b6-6f9f-f43151013b80,person,Michael Elkins,Vice President,,red-ventures,v1455217906/n6znj8vxg1vgfdb4tomh.jpg,e0a75ec2-43d3-5dec-5729-3a6825c8325a,organization,Red Ventures,male
5832c3da-c052-1bce-4876-2676b48b7eed,Kamal Shah,kamal-shah-2,v1434499507/jxnj28ebupa35or7pdoe.jpg,5832c3da-c052-1bce-4876-2676b48b7eed,person,Kamal Shah,"VP, Cloud Platforms","Kamal Shah is the VP, Cloud Platforms at Red Hat. He attended Harvard Business School",red-hat,pimffexdfltu9sn403be,427e8f37-684f-1cdf-cc36-a1ee0faf9701,organization,Red Hat,not_provided
3604d657-4a73-421d-f805-b8cbc5e170b5,Tim Yeaton,tim-yeaton,vy441gqr7rsqckkcfols,3604d657-4a73-421d-f805-b8cbc5e170b5,person,Tim Yeaton,Executive Vice President & Chief Marketing Officer,,red-hat,pimffexdfltu9sn403be,427e8f37-684f-1cdf-cc36-a1ee0faf9701,organization,Red Hat,male
d361ca5f-f361-1467-4695-046da367e444,Chris Wright,chris-wright-2,v1484113682/ddf95bfbx2ob7b955trh.png,d361ca5f-f361-1467-4695-046da367e444,person,Chris Wright,Senior Vice President and Chief Technology Officer,,red-hat,pimffexdfltu9sn403be,427e8f37-684f-1cdf-cc36-a1ee0faf9701,organization,Red Hat,male
80ff965d-2ab8-4e6c-b2ee-6289fe355ce2,Luis I. Cortes,lui-i-cortes,v1504691231/pwydbfelvoo89ufbmimc.png,80ff965d-2ab8-4e6c-b2ee-6289fe355ce2,person,Luis I. Cortes,Head of Marketing & Sales Programs,"Luis I. Cortes is the Head of Marketing & Sales Programs, Red Hat Middleware at Red Hat. Luis I. Cortes attended Esade.",red-hat,pimffexdfltu9sn403be,427e8f37-684f-1cdf-cc36-a1ee0faf9701,organization,Red Hat,female
ca8e3b30-a445-2ab9-fac2-ee625917f826,Marco Bill-Peter,marco-bill-peter,v1427772962/iodytwm4p5ddtla98yml.jpg,ca8e3b30-a445-2ab9-fac2-ee625917f826,person,Marco Bill-Peter,VP Customer Engagement and Experience,,red-hat,pimffexdfltu9sn403be,427e8f37-684f-1cdf-cc36-a1ee0faf9701,organization,Red Hat,male
621f6d12-56d0-2500-2164-d93b246ffd6f,DeLisa Alexander,delisa-alexander,v1397182283/c8e83420b3bbbdf31607775de1a2540d.jpg,621f6d12-56d0-2500-2164-d93b246ffd6f,person,DeLisa Alexander,Executive vice president and chief people officer,"DeLisa Alexander, executive vice president and chief people officer, leads the organization responsible for global human resources, including Red Hat® University.The organization's mission is to be a strategic partner to the business in acquiring, developing,and retaining talent and to enhance the Red Hat culture and talent brand.Red Hat has been recognized as one of the best places to work in multiple publications around the globe on many occasions.
In 2010, Alexander received a ""Women in Business"" executive award from the Triangle Business Journal. Alexander serves on the executive committee of the Board of the Greater Raleigh Chamber of Commerce, the NC State Management College Diversity Board, and the advisory boards of the Connected Women of North Carolina and the Raleigh Junior League.

Alexander joined Red Hat in 2001 and served in the office of General Counsel until mid 2006, most recently as assistant general counsel and assistant secretary. During this time, Alexander was responsible for, among other items, equity and executive compensation, and trademark, copyright, and employment matters. Alexander also advised the company's management and board of directors on securities and corporate governance.
Prior to joining Red Hat, Alexander was associated with the law firm Kilpatrick Stockton where she focused on mergers, acquisitions, venture capital, and intellectual property licensing. She started her career as a judicial clerk for the Honorable William B. Chandler, chancellor of the renowned Delaware Court of Chancery.",red-hat,pimffexdfltu9sn403be,427e8f37-684f-1cdf-cc36-a1ee0faf9701,organization,Red Hat,female
350da357-43ee-29ac-3ec0-ffaed0280e22,Chris Gray,chris-gray-2,v1491457460/n6ct3ppcclew91cl5cug.png,350da357-43ee-29ac-3ec0-ffaed0280e22,person,Chris Gray,"Vice President, Strategic Alliances, North America",,red-hat,pimffexdfltu9sn403be,427e8f37-684f-1cdf-cc36-a1ee0faf9701,organization,Red Hat,male
fe4d92e5-b54d-cc9d-5dde-7942fcc5a871,Sarangan Rangachari,sarangan-rangachari,v1397182297/a369eb177e90bedbbd61a062d2afea94.jpg,fe4d92e5-b54d-cc9d-5dde-7942fcc5a871,person,Sarangan Rangachari,"Vice president, Storage Business Unit","Sarangan Rangachari leads the Storage business unit at Red Hat and is responsible for the overall strategy and execution of Red Hat’s storage software portfolio. Prior to this role, Rangachari drove Red Hat’s Cloud ecosystem strategy. He joined Red Hat in 2010 with more than 25 years of industry experience, including in-depth software product management and product marketing experience, and 18 years in storage software.

Prior to Red Hat, Rangachari was the CEO for multiple start-up companies in the systems and storage management space. He founded Invio Software (acquired by Veritas/Symantec), was VP/GM of AP/J Region, and led product management and marketing for Legato Systems (acquired by EMC). Early in his career, Rangachari worked in various product management roles at Sun Microsystem",red-hat,pimffexdfltu9sn403be,427e8f37-684f-1cdf-cc36-a1ee0faf9701,organization,Red Hat,male
da958b3f-0b95-02ae-12b2-d5303f240ad6,Mandeep Chaddha,mandeep-chaddha,v1460724550/hocmjxnl9sj5qjd6wtor.jpg,da958b3f-0b95-02ae-12b2-d5303f240ad6,person,Mandeep Chaddha,"Vice President, Global Sales Operations",,red-hat,pimffexdfltu9sn403be,427e8f37-684f-1cdf-cc36-a1ee0faf9701,organization,Red Hat,male
1e1168a7-b3a5-bc9a-ada5-cff528315a86,Craig Muzilla,craig-muzilla,v1408594456/xlkp3mzi855zf6broyul.jpg,1e1168a7-b3a5-bc9a-ada5-cff528315a86,person,Craig Muzilla,"Senior Vice President, Core Products and Cloud Services Business Group",,red-hat,pimffexdfltu9sn403be,427e8f37-684f-1cdf-cc36-a1ee0faf9701,organization,Red Hat,male
cfa96556-8f60-dd05-d710-2be662074c5b,Michael Cunningham,michael-cunningham,v1397182293/f9e956fc2258d497b749fbbccae9ab57.jpg,cfa96556-8f60-dd05-d710-2be662074c5b,person,Michael Cunningham,Executive vice president and general counsel,"With more than 20 years of business and legal experience in the global marketplace, Michael Cunningham joined Red Hat® in June 2004 as general counsel. Prior to Red Hat, Cunningham served as associate general counsel for IBM as well as partner and associate general counsel for PricewaterhouseCoopers.

At IBM, Cunningham was head legal advisor to the Business Consulting Services division for Europe, the Middle East, and Africa (EMEA), as well as a member of the global Senior Management Team for Business Consulting Services.

At PricewaterhouseCoopers, Cunningham's work included global responsibility for the delivery of transactional legal services to PricewaterhouseCoopers Consulting, as well as the role of lead lawyer in EMEA for this business. Before entering the practice of law, Cunningham was an engineer with Sperry Defense Electronics—now Unisys.

Cunningham earned a Bachelor of Science in applied mathematics and statistics at State University of New York at Stony Brook and a JD from the University of Pennsylvania Law School. He is a member of numerous professional and legal organizations, including the Business Law Section of the American Bar Association and the Computer Law Association.",red-hat,pimffexdfltu9sn403be,427e8f37-684f-1cdf-cc36-a1ee0faf9701,organization,Red Hat,male
bcd3e72a-f262-8ca9-b767-6aa0f6eea689,Henry Shelton,h-hugh-shelton,v1452150322/h8vmvvw5g4r68qkehk2k.png,bcd3e72a-f262-8ca9-b767-6aa0f6eea689,person,Henry Shelton,Chairman of the Board of Directors,"Henry Shelton is originally from Speed, North Carolina, a town near Tarboro in eastern North Carolina. 

Henry spent the next 38 years in a variety of command and staff positions in the continental United States, Hawaii and Vietnam. Henry served two combat tours in Vietnam, the first with the 5th Special Forces Group and the second with the 173rd Airborne Brigade. Henry also commanded the 3d Battalion, 60th Infantry in the 9th Infantry Division at Fort Lewis, Washington; served as the 9th Infantry Division's Chief of Staff for operations; commanded the 1st Brigade of the 82nd Airborne Division at Fort Bragg, North Carolina; and, was the Chief of Staff of the 10th Mountain Division at Fort Drum, New York. 

Henry became the 14th Chairman of the Joint Chiefs of Staff on October 1, 1997, and served two two-year terms, retiring on September 30, 2001. Throughout his tenure as Chairman, U.S. forces were in heavy demand and participated in numerous joint operations around the globe. 

Henry received a Bachelor's degree in Textiles from North Carolina State University and was commissioned as a second lieutenant in the Infantry through the Reserve Officer Training Corps. Henry holds a Master's degree from Auburn University and has attended Harvard University, the Air Command and Staff College and the National War College. 

Among his many military awards, Henry has received four Defense Distinguished Service Medals, two Army Distinguished Service Medals, the Legion of Merit, the Bronze Star Medal for Valor, and the Purple Heart. 

Henry has been decorated by 16 foreign governments and, in 2001; General Shelton was knighted by Queen Elizabeth II.For his exemplary service to his country, the 107th Congress bestowed the Congressional Gold Medal on General Shelton on September 19, 2002. He is currently Chairman of the Board of Red Hat, Inc and serves as a director of L-3 Communications. In addition he serves as a director for the following private companies: CoVant, AT Solutions, Robbins-Gioia, The O'Gara Group, Professional Products Enterprises and HighMark. 

Henry is also the Executive Director of the General Hugh Shelton Leadership Center at North Carolina State University and serves as Director of the Hugh and Carolyn Shelton Military Neurotrauma Foundation, Washington, DC. 

In 2009 Henry's book,"" Secrets of Success, Values-Based Leaders"", was released, and his autobiography, ""Without Hesitation"", was released in October 2010.",red-hat,pimffexdfltu9sn403be,427e8f37-684f-1cdf-cc36-a1ee0faf9701,organization,Red Hat,male
f29fab00-2918-1f06-b634-cca6a10ec0f9,Rob Tiller,rob-tiller,v1397182299/2e9d5e7d9d870f18f26b6a92171b55c8.jpg,f29fab00-2918-1f06-b634-cca6a10ec0f9,person,Rob Tiller,Vice president and assistant general counsel,"Rob Tiller brings more than 20 years of legal expertise to Red Hat®, where he serves as vice president and assistant general counsel. He's responsible for Red Hat's internal intellectual property team, covering open source licensing, copyright, patent, and trademark law. Tiller also works on the development of policies and strategies related to open source legal matters.

Tiller joined Red Hat from Helms, Mulliss & Wicker, where he was a partner specializing in intellectual property and technology litigation, commercial litigation, and antitrust. He also served as a law clerk for Justice Antonin Scalia of the United States Supreme Court and for Judge Stephen Williams of the United States Court of Appeals for the District of Columbia Circuit.",red-hat,pimffexdfltu9sn403be,427e8f37-684f-1cdf-cc36-a1ee0faf9701,organization,Red Hat,male
b955f9f0-5b6b-0847-24a7-c15ba805bf9f,Ken Goetz,ken-goetz,v1427816991/iyugtwbgrhhvztsszqbv.jpg,b955f9f0-5b6b-0847-24a7-c15ba805bf9f,person,Ken Goetz,"Vice President, Core Technology Services",,red-hat,pimffexdfltu9sn403be,427e8f37-684f-1cdf-cc36-a1ee0faf9701,organization,Red Hat,male
ae020f32-9446-ddbb-b102-2f094f37a6c1,Gunnar Hellekson,gunnar-hellekson,,ae020f32-9446-ddbb-b102-2f094f37a6c1,person,Gunnar Hellekson,Vice President,,red-hat,pimffexdfltu9sn403be,427e8f37-684f-1cdf-cc36-a1ee0faf9701,organization,Red Hat,male
c272b478-2b36-f38b-5e6b-bb2812d61568,Rob Cardwell,rob-cardwell,v1435149837/evwazfcfnj9mbk6iavkj.png,c272b478-2b36-f38b-5e6b-bb2812d61568,person,Rob Cardwell,VP Vertical Markets & Industry Solutions,,red-hat,pimffexdfltu9sn403be,427e8f37-684f-1cdf-cc36-a1ee0faf9701,organization,Red Hat,male
88839d7b-9cb1-9efe-4716-3678ab278f31,Mark Little,mark-little-6,v1455092979/anxnjudk25pve048l98v.png,88839d7b-9cb1-9efe-4716-3678ab278f31,person,Mark Little,VP Engineering,,red-hat,pimffexdfltu9sn403be,427e8f37-684f-1cdf-cc36-a1ee0faf9701,organization,Red Hat,male
422d7eef-19d7-433d-9ad1-1f68ba12fbab,Fabio Pereira,fabio-pereira,ixotn7ckghrcjr48nqvu,422d7eef-19d7-433d-9ad1-1f68ba12fbab,person,Fabio Pereira,Head of Open Innovation Labs in Latin America,Fabio Pereira is the head of open innovation labs in Latin America at Red Hat.,red-hat,pimffexdfltu9sn403be,427e8f37-684f-1cdf-cc36-a1ee0faf9701,organization,Red Hat,male
30f5f13e-dc6c-e089-1d06-7b6e279ecb31,Jackie Yeaney,jackie-yeaney,v1397180263/45dce5198846e09b807f20481f505f4b.png,30f5f13e-dc6c-e089-1d06-7b6e279ecb31,person,Jackie Yeaney,"Executive vice president, Strategy and Corporate Marketing","Jackie Yeaney is responsible for orchestrating Red Hat's strategy formulation and planning, Brand, Global Programs, Global Partner Marketing, Marketing Services, Marketing Operations, and Global Field
Marketing.

Prior to joining Red Hat, Jackie held CMO roles at PGi, a global communications company, EarthLink, and HomeBanc Mortgage Corporation. She was also the managing director of Consumer Marketing at Delta Air Lines. Before her career in marketing she spent several years with the Boston Consulting Group and was a captain in the U.S. Air Force.

Jackie was a 2009 and 2010 Women in Technology (WIT) Woman of the Year honoree, a finalist for the 2010 Atlanta Corporate Marketer of the Year and winner of the 2010 Womenetics POW! Award. She serves as co-president of the board Open Hand, an Atlanta-based non-profit that helps people prevent or better manage chronic illness through nutrition services. In 2012, Jackie was named the Georgia Center for Nonprofits’ Revolutions Award Winner for Outstanding Nonprofit Board Member.

Jackie holds an MBA from the Sloan School of Management at MIT and a BS, magna cum laude, in electrical engineering from Rensselaer Polytechnic Institute.

Jackie lives in Marietta, GA with her husband Eric, and their three children, Connor (19), Carissa (16), and Alec (13). She spends a bulk of her free time as a soccer mom.",red-hat,pimffexdfltu9sn403be,427e8f37-684f-1cdf-cc36-a1ee0faf9701,organization,Red Hat,female
6359270b-877a-7d91-5fa6-c92cab8cd616,Mark Enzweiler,mark-enzweiler,v1397182294/eab2fd8244543777cabe7b79b719c0fe.png,6359270b-877a-7d91-5fa6-c92cab8cd616,person,Mark Enzweiler,"Vice president, Global Alliances and Channels","Mark Enzweiler serves as vice president, Global Channels for Red Hat. In this role, he is responsible for the development and execution of global channels strategy and sales. Enzweiler first joined Red Hat in 2006 as vice president of North America Channel Sales, a position he held for 18 months.

Prior to joining Red Hat, Enzweiler served as vice president of Global Channel Strategy and Sales for Lenovo. Earlier in his career, Enzweiler spent 25 years with IBM in various GM and channel executive roles, including GM of Europe, Middle East, and Africa and Latin America of the Personal Systems Group and of the Global Chemical and Petroleum Industry Group. There, Enzweiler was responsible for IBM's total business—hardware, software, and services—in these key industries and directed resources to develop and deliver solutions to the chemical and petroleum industries' top business challenges.

Enzweiler holds an MBA from Xavier University and a BS in psychology from Northern Kentucky University.",red-hat,pimffexdfltu9sn403be,427e8f37-684f-1cdf-cc36-a1ee0faf9701,organization,Red Hat,male
b4ed394f-1ecb-484f-8bc5-0b7beaef360f,Dirk-Peter van Leeuwen,dirk-peter-van-leeuwen,zaecs4j44evq2trpce6f,b4ed394f-1ecb-484f-8bc5-0b7beaef360f,person,Dirk-Peter van Leeuwen,Senior Vice President & GM Red Hat Asia Pacific & Japan,,red-hat,pimffexdfltu9sn403be,427e8f37-684f-1cdf-cc36-a1ee0faf9701,organization,Red Hat,male
a472d96f-159f-8d68-0667-8b37f740aefa,Tim Burke,tim-burke-5,v1455013768/v36cc7hw44bpkr3ps4q7.png,a472d96f-159f-8d68-0667-8b37f740aefa,person,Tim Burke,"VP, Cloud & Operating System Infrastructure",,red-hat,pimffexdfltu9sn403be,427e8f37-684f-1cdf-cc36-a1ee0faf9701,organization,Red Hat,male
c0d48751-6794-b3b8-7189-0f91e8c58d8c,General Hugh Shelton,general-hugh-shelton,v1461320180/jka4ynbvsapvmaq4lnn2.jpg,c0d48751-6794-b3b8-7189-0f91e8c58d8c,person,General Hugh Shelton,Chairman of the Board,,red-hat,pimffexdfltu9sn403be,427e8f37-684f-1cdf-cc36-a1ee0faf9701,organization,Red Hat,male
00b9a8b1-1b39-0cc2-18f5-46608f425657,Ronnie Sarkar,ronnie-sarkar,,00b9a8b1-1b39-0cc2-18f5-46608f425657,person,Ronnie Sarkar,Senior Vice President of Digital Solutions,"Ronnie Sarkar is a Senior Vice President of Digital Solutions at R. R Donnelley & Sons Company (NASDAQ GS: RRD). In this capacity, Ronnie is responsible for the Research & Development and the Product Management groups of the company. 

During his 21-year tenure at RRD, Ronnie has served in various operational and technical capacities, including the formation and growth of their premedia business and the establishment of their off-shoring capabilities in Asia.

Prior to joining RRD, Ronnie worked for five years at the consulting firm of Arthur D. Little Inc. in Boston focusing in the semiconductor and consumer electronics areas.

Ronnie obtained his B.S. in engineering from the Indian Institute of Technology and his Ph.D from Rutgers University. He also has a MBA from the Kellogg School of Management at Northwestern University.",rr-donnelley,v1491100076/amrf4ujovxaqdhu5pvcz.png,4f9f31eb-c970-4c16-4488-ddf9ad5af9b0,organization,RR Donnelley & Sons,male
3ad9541f-12c0-3e72-5c46-c9756a17b275,Andre Durand,andre-durand,v1413551522/vojdpzlw0cdg1miurgk9.png,3ad9541f-12c0-3e72-5c46-c9756a17b275,person,Andre Durand,Founder & CEO,CEO Ping Identity NYSE:PING.,ping-identity-corporation,v1397198103/24ce5c8afb725709687ad0d868d5f615.png,f9306388-6a94-0bce-328d-55423c0e9b2d,organization,Ping Identity,male
276c66ef-cd2d-feae-3a5e-bd107354694d,Dave Packer,dave-packer-2,v1471257744/b8yqvprgeiumzd965mz0.jpg,276c66ef-cd2d-feae-3a5e-bd107354694d,person,Dave Packer,Senior Vice President of Field Operations,"“In sales, there’s nothing like winning customers. I’m a firm believer that if you can’t finish first, finish last fast. Today’s sales world is a true balance of art and science, where great solutions are crafted to equally benefit the company and the customer...everyone wins.”

Bringing more than 20 years of high-technology software experience with leadership roles in sales, field operations, alliances, professional services and support, Dave was already a globally seasoned expert before Ping. He joined the team after holding the ranks of Senior Vice President of Worldwide Field Operations at two separate companies over the span of 11 years, E2open and Borland Software. Prior to driving worldwide sales, Dave oversaw the Western Region for PeopleSoft when they acquired JD Edwards,  where he started his career in Enterprise Software. Dave holds a master’s degree from the Massachusetts Institute of Technology.",ping-identity-corporation,v1397198103/24ce5c8afb725709687ad0d868d5f615.png,f9306388-6a94-0bce-328d-55423c0e9b2d,organization,Ping Identity,male
f97b4ee7-0316-b1bb-dbd3-c98c871c9158,Armin Ebrahimi,armin-ebrahimi,v1482840340/hmc5xnnlzlduagxtro3d.png,f97b4ee7-0316-b1bb-dbd3-c98c871c9158,person,Armin Ebrahimi,Head of Distributed Identity,Armin Ebrahimi is Head of Distributed Identity at Ping Identity. He attended Capella University.,ping-identity-corporation,v1397198103/24ce5c8afb725709687ad0d868d5f615.png,f9306388-6a94-0bce-328d-55423c0e9b2d,organization,Ping Identity,male
